{
  "artifact_validation": {
    "error_count": 0,
    "passed": true,
    "target_count": 3,
    "targets": [
      {
        "error_count": 0,
        "passed": true,
        "type": "promotion_cards",
        "warning_count": 0
      },
      {
        "error_count": 0,
        "passed": true,
        "type": "promotion_decision",
        "warning_count": 0
      },
      {
        "error_count": 0,
        "passed": true,
        "type": "promotion_alias_apply",
        "warning_count": 0
      }
    ],
    "warning_count": 0
  },
  "artifacts": {
    "compare_gate": {
      "exists": true,
      "kind": "file",
      "path": "compare_gate.json",
      "role": "compare_gate",
      "schema_version": "hfr.compare_gate.v1",
      "sha256": "26210e3a60354af9caaf8340eadcd2cca4779c217c2db75e9e198ca1225491e3",
      "size_bytes": 16328
    },
    "promotion_alias_apply": {
      "exists": true,
      "kind": "file",
      "path": "promotion_alias_apply.json",
      "role": "promotion_alias_apply",
      "schema_version": "hfr.promotion_alias_apply.v1",
      "sha256": "53768daae3069e8361813b985534cf9bdc31f178a26caea72f769a31548a6507",
      "size_bytes": 8372
    },
    "promotion_cards": {
      "exists": true,
      "file_count": 3,
      "kind": "directory",
      "path": "promotion_cards",
      "role": "promotion_cards",
      "sha256": "4072ba5a0df73d9f419958d1f80b380efc67fba5787cedc33e45294969140848"
    },
    "promotion_decision": {
      "exists": true,
      "kind": "file",
      "path": "promotion_decision.json",
      "role": "promotion_decision",
      "schema_version": "hfr.promotion_decision.v1",
      "sha256": "10c6390edb069b25a053f03e699137657235212f1487cc557ce3850b8e80d343",
      "size_bytes": 32793
    },
    "release_notes": {
      "exists": true,
      "kind": "file",
      "path": "RELEASE_NOTES.md",
      "role": "release_notes",
      "sha256": "c5d6ba8f4563b659c9aae9a52fc9f115274efa26bbdd5521f7b2802580fa0dd0",
      "size_bytes": 374
    },
    "rollback_metadata": {
      "exists": true,
      "kind": "file",
      "path": "promotion_rollback_receipt.json",
      "role": "rollback_metadata",
      "schema_version": "hfr.promotion_rollback_receipt.v1",
      "sha256": "343ad264f6f4058df1cffba4fa8ee23bb407625b589959ded228503f8428ff39",
      "size_bytes": 4608
    }
  },
  "bindings": {
    "compare_gate_sha256": "26210e3a60354af9caaf8340eadcd2cca4779c217c2db75e9e198ca1225491e3",
    "dataset_card_sha256": "626ad2476973bb18977190d1b69e10b72af931ea4628312098fb45f96b92307c",
    "model_card_sha256": "c5f62c808ad1d79f1f35af71919e135e25e5597b6b815e79f826b702ab1f342f",
    "promotion_alias_apply_sha256": "53768daae3069e8361813b985534cf9bdc31f178a26caea72f769a31548a6507",
    "promotion_cards_sha256": "4072ba5a0df73d9f419958d1f80b380efc67fba5787cedc33e45294969140848",
    "promotion_decision_sha256": "10c6390edb069b25a053f03e699137657235212f1487cc557ce3850b8e80d343",
    "release_notes_sha256": "c5d6ba8f4563b659c9aae9a52fc9f115274efa26bbdd5521f7b2802580fa0dd0",
    "rollback_metadata_sha256": "343ad264f6f4058df1cffba4fa8ee23bb407625b589959ded228503f8428ff39"
  },
  "check_count": 28,
  "checks": [
    {
      "actual": true,
      "expected": {
        "present": true
      },
      "id": "release_id_present",
      "passed": true,
      "summary": "release id is present"
    },
    {
      "actual": {
        "exists": true,
        "kind": "file",
        "path": "promotion_decision.json"
      },
      "expected": {
        "exists": true
      },
      "id": "promotion_decision_present",
      "passed": true,
      "scope": {
        "artifact_role": "promotion_decision"
      },
      "summary": "promotion_decision artifact is present and fingerprinted"
    },
    {
      "actual": {
        "exists": true,
        "kind": "directory",
        "path": "promotion_cards"
      },
      "expected": {
        "exists": true
      },
      "id": "promotion_cards_present",
      "passed": true,
      "scope": {
        "artifact_role": "promotion_cards"
      },
      "summary": "promotion_cards artifact is present and fingerprinted"
    },
    {
      "actual": {
        "exists": true,
        "kind": "file",
        "path": "promotion_alias_apply.json"
      },
      "expected": {
        "exists": true
      },
      "id": "promotion_alias_apply_present",
      "passed": true,
      "scope": {
        "artifact_role": "promotion_alias_apply"
      },
      "summary": "promotion_alias_apply artifact is present and fingerprinted"
    },
    {
      "actual": {
        "exists": true,
        "kind": "file",
        "path": "promotion_rollback_receipt.json"
      },
      "expected": {
        "exists": true
      },
      "id": "rollback_metadata_present",
      "passed": true,
      "scope": {
        "artifact_role": "rollback_metadata"
      },
      "summary": "rollback_metadata artifact is present and fingerprinted"
    },
    {
      "actual": {
        "exists": true,
        "kind": "file",
        "path": "compare_gate.json"
      },
      "expected": {
        "exists": true
      },
      "id": "compare_gate_present",
      "passed": true,
      "scope": {
        "artifact_role": "compare_gate"
      },
      "summary": "compare_gate artifact is present and fingerprinted"
    },
    {
      "actual": {
        "exists": true,
        "kind": "file",
        "path": "RELEASE_NOTES.md"
      },
      "expected": {
        "exists": true
      },
      "id": "release_notes_present",
      "passed": true,
      "scope": {
        "artifact_role": "release_notes"
      },
      "summary": "release_notes artifact is present and fingerprinted"
    },
    {
      "actual": "hfr.promotion_decision.v1",
      "expected": {
        "schema_version": "hfr.promotion_decision.v1"
      },
      "id": "promotion_decision_schema",
      "passed": true,
      "scope": {
        "artifact_role": "promotion_decision"
      },
      "summary": "promotion decision uses the expected schema"
    },
    {
      "actual": "hfr.promotion_cards.v1",
      "expected": {
        "schema_version": "hfr.promotion_cards.v1"
      },
      "id": "promotion_cards_schema",
      "passed": true,
      "scope": {
        "artifact_role": "promotion_cards"
      },
      "summary": "promotion cards manifest uses the expected schema"
    },
    {
      "actual": "hfr.promotion_alias_apply.v1",
      "expected": {
        "schema_version": "hfr.promotion_alias_apply.v1"
      },
      "id": "promotion_alias_apply_schema",
      "passed": true,
      "scope": {
        "artifact_role": "promotion_alias_apply"
      },
      "summary": "promotion alias receipt uses the expected schema"
    },
    {
      "actual": "hfr.compare_gate.v1",
      "expected": {
        "schema_version": "hfr.compare_gate.v1"
      },
      "id": "compare_gate_schema",
      "passed": true,
      "scope": {
        "artifact_role": "compare_gate"
      },
      "summary": "compare_gate uses the expected schema version"
    },
    {
      "actual": true,
      "expected": {
        "passed": true
      },
      "id": "promotion_decision_passed",
      "passed": true,
      "scope": {
        "artifact_role": "promotion_decision"
      },
      "summary": "promotion_decision reports passed=true"
    },
    {
      "actual": true,
      "expected": {
        "passed": true
      },
      "id": "promotion_cards_passed",
      "passed": true,
      "scope": {
        "artifact_role": "promotion_cards"
      },
      "summary": "promotion_cards reports passed=true"
    },
    {
      "actual": true,
      "expected": {
        "passed": true
      },
      "id": "promotion_alias_apply_passed",
      "passed": true,
      "scope": {
        "artifact_role": "promotion_alias_apply"
      },
      "summary": "promotion_alias_apply reports passed=true"
    },
    {
      "actual": true,
      "expected": {
        "passed": true
      },
      "id": "compare_gate_passed",
      "passed": true,
      "scope": {
        "artifact_role": "compare_gate"
      },
      "summary": "compare_gate reports passed=true"
    },
    {
      "actual": true,
      "expected": {
        "passed": true
      },
      "id": "input_artifacts_validated",
      "passed": true,
      "summary": "release-record input artifacts passed validation immediately before binding"
    },
    {
      "actual": {
        "exists": true,
        "kind": "file",
        "path": "../../promotion_policy.demo.json"
      },
      "expected": {
        "exists": true,
        "kind": "file"
      },
      "id": "promotion_policy_present",
      "passed": true,
      "scope": {
        "artifact_role": "promotion_policy"
      },
      "summary": "promotion policy artifact is present for release binding"
    },
    {
      "actual": "hfr.promotion_policy.v1",
      "expected": {
        "schema_version": "hfr.promotion_policy.v1"
      },
      "id": "promotion_policy_schema",
      "passed": true,
      "scope": {
        "artifact_role": "promotion_policy"
      },
      "summary": "promotion policy uses the expected schema version"
    },
    {
      "actual": {
        "missing": [],
        "roles": [
          "compare_gate",
          "promotion_alias_apply",
          "promotion_cards",
          "promotion_decision",
          "release_notes",
          "rollback_metadata"
        ],
        "unknown": []
      },
      "expected": {
        "roles": [
          "promotion_decision",
          "promotion_cards",
          "promotion_alias_apply",
          "rollback_metadata",
          "compare_gate",
          "release_notes"
        ]
      },
      "id": "promotion_policy_release_artifacts_complete",
      "passed": true,
      "scope": {
        "artifact_role": "promotion_policy"
      },
      "summary": "promotion policy covers every release-record artifact role"
    },
    {
      "actual": {